{
  "$schema": "http://json-schema.org/draft-07/schema#",
  "title": "Trace Schema",
  "type": "object",
  "properties": {
    "trace_id": {"type": "string"},
    "timestamp": {"type": "string"},
    "user_input": {"type": "string"},
    "obligations": {"type": "array"},
    "tool_runs": {"type": "array"},
    "assertions": {"type": "array"},
    "verification": {"type": "object"},
    "status": {"type": "string"},
    "final_answer": {"type": "string"},
    "metrics": {"type": "object"},
    "capabilities_satisfied": {"type": "array", "items": {"type": "string"}}
  },
  "required": ["trace_id", "timestamp", "tool_runs", "status", "metrics"],
  "additionalProperties": true
}


