{"trace_id":"da43b0a5-fd60-4746-869a-dcf1b826cf48","timestamp":"2025-09-05T16:58:43.668085","user_input":"(api)","obligations":[{"id":"OB_1_da43b0a5-fd60-4746-869a-dcf1b826cf48","status":"resolved"}],"tool_runs":[{"id":"OB_1_da43b0a5-fd60-4746-869a-dcf1b826cf48","tool_name":"Reasoning.Core","success":false,"duration_ms":0,"error":null,"clarify_slot":null,"inputs":{"mode":"deduction","query":{"predicate":"grandparentOf","args":["Alice","Cara"]},"facts":[{"predicate":"parentOf","args":["Alice","Bob"]},{"predicate":"parentOf","args":["Bob","Cara"]}],"rules":[],"domains":["kinship"],"simulate_slow":null,"budgets":{"max_depth":1,"beam":1,"time_ms":1}},"outputs":{"status":"truncated","kind":"logic.answer","value":null,"trajectory":{"steps":[],"alt_paths":[],"metrics":{"depth_used":1,"nodes_expanded":0,"time_ms":0}},"capabilities_satisfied":["REPORT.logic"]}}],"assertions":[],"verification":{"passed":true,"method":"disabled","details":"Verification disabled","duration_ms":0,"error":null},"status":"failed","final_answer":"I couldn't generate a proper answer.","metrics":{"total_latency_ms":7,"obligation_count":1,"tool_run_count":1,"assertion_count":0,"verification_passed":true,"escalation_count":0,"clarify_count":0,"success_rate":0.0},"capabilities_satisfied":["REPORT.logic"]}