{"trace_id":"2c4a259b-ad89-4a1e-ad62-0487a95ed7db","timestamp":"2025-09-05T16:58:43.500545","user_input":"(api)","obligations":[{"id":"OB_1_2c4a259b-ad89-4a1e-ad62-0487a95ed7db","status":"resolved"}],"tool_runs":[{"id":"OB_1_2c4a259b-ad89-4a1e-ad62-0487a95ed7db","tool_name":"Reasoning.Core","success":true,"duration_ms":0,"error":null,"clarify_slot":null,"inputs":{"mode":"deduction","query":{"predicate":"grandparentOf","args":["Alice","Cara"]},"facts":[{"predicate":"parentOf","args":["Alice","Bob"]},{"predicate":"parentOf","args":["Bob","Cara"]}],"rules":[],"domains":["kinship"],"simulate_slow":null,"budgets":{"max_depth":3,"beam":4,"time_ms":100}},"outputs":{"kind":"logic.answer","value":true,"trajectory":{"steps":[{"op":"infer","rule":"parent∘parent→grandparent","bindings":{"X":"Alice","Y":"Bob","Z":"Cara"}}],"alt_paths":[],"metrics":{"depth_used":1,"nodes_expanded":1,"time_ms":0},"rules_fired":["parent∘parent→grandparent"],"why_not":[]},"assertions":[{"subject":"Alice","predicate":"grandparentOf","object":"Cara","proof_ref":"local","rule_version":"parent∘parent→grandparent@1"}],"capabilities_satisfied":["REPORT.logic"]}}],"assertions":[{"id":"A_OB_1_2c4a259b-ad89-4a1e-ad62-0487a95ed7db_logic_0","subject_id":"Alice","predicate":"grandparentOf","object":"Cara","rule_version":"parent∘parent→grandparent@1","proof_ref":"T_OB_1_2c4a259b-ad89-4a1e-ad62-0487a95ed7db","source_id":"Reasoning.Core@0.1.0","confidence":1.0}],"verification":{"passed":true,"method":"disabled","details":"Verification disabled","duration_ms":0,"error":null},"status":"resolved","final_answer":"true","metrics":{"total_latency_ms":6,"obligation_count":1,"tool_run_count":1,"assertion_count":1,"verification_passed":true,"escalation_count":0,"clarify_count":0,"success_rate":1.0},"capabilities_satisfied":["REPORT.logic"]}